### ISSUE TITLE
Outbound packets to Heroku server

### ISSUE THREAD

**Issue by imtheghoul** [hashicorp/consul#1686]
I tested Consul cluster setup without internet access - it's working.
Then I stopped cluster, ran tshark tool for outgoing connections for WAN interface and started cluster again.
I've found that bootstrap server is appeals to 54.225.222.88 and browser shows that's some Heroku server with apps.
1. What is this connections for? Cluster works without internet, so it's not necessary.
2. How can I disable it?

50 146.121655952    10.0.2.15 -> 54.225.222.88 TCP 74 54600 > https [SYN] Seq=0 Win=14600 Len=0 MSS=1460 SACK_PERM=1 TSval=336121353 TSecr=0 WS=128
 51 146.265738886    10.0.2.15 -> 54.225.222.88 TCP 54 54600 > https [ACK] Seq=1 Ack=1 Win=1868800 Len=0
 52 146.266022249    10.0.2.15 -> 54.225.222.88 SSL 219 Client Hello
 53 146.421536988    10.0.2.15 -> 54.225.222.88 TCP 54 54600 > https [ACK] Seq=166 Ack=1449 Win=2181120 Len=0
 54 146.421579917    10.0.2.15 -> 54.225.222.88 TCP 54 54600 > https [ACK] Seq=166 Ack=2869 Win=2544640 Len=0
 55 146.421952426    10.0.2.15 -> 54.225.222.88 TCP 54 54600 > https [ACK] Seq=166 Ack=3639 Win=2908160 Len=0
 56 146.448020089    10.0.2.15 -> 54.225.222.88 TLSv1.2 129 Client Key Exchange
 57 146.448319378    10.0.2.15 -> 54.225.222.88 TLSv1.2 60 Change Cipher Spec
 58 146.448449930    10.0.2.15 -> 54.225.222.88 TLSv1.2 99 Hello Request, Hello Request
 59 146.784427725    10.0.2.15 -> 54.225.222.88 TLSv1.2 319 Application Data
 60 147.037146566    10.0.2.15 -> 54.225.222.88 TLSv1.2 85 Encrypted Alert
 61 147.037159028    10.0.2.15 -> 54.225.222.88 TCP 54 54600 > https [FIN, ACK] Seq=588 Ack=4362 Win=3271680 Len=0
 62 147.212333676    10.0.2.15 -> 54.225.222.88 TCP 54 54600 > https [RST] Seq=589 Win=0 Len=0
 63 147.212348025    10.0.2.15 -> 54.225.222.88 TCP 54 54600 > https [RST] Seq=589 Win=0 Len=0

**Comment by blalor** [comment]
https://www.consul.io/docs/agent/options.html#disable_update_check

**Comment by imtheghoul** [comment]
@blalor Thanks!! This is it!
