### ISSUE TITLE
Joining multiple datacenters, failed but ports open

### ISSUE THREAD

**Issue by djenriquez** [hashicorp/consul#1245]
Hello,

I have set up multiple datacenters in AWS in regions us-west-2, us-east-1, and eu-west-1, each running 5 consul servers.

I ssh'd into one instance in eu-west-1 and ran `consul join -wan 10.179.3.152` which is the private IP of a consul server in us-west-2. I ssh'd into another instance in us-east-1 and ran `consul join -wan 10.179.3.152`. So now all three regions should be connected.

When I navigate to 10.179.3.152:8500 in a browser, it brings me up to a new screen that lets me choose a datacenter, however it just sits in the loading screen for the other datacenters and reports this in the logs:

```
2015/09/17 22:24:26 [ERR] http: Request /v1/internal/ui/nodes?dc=eu-west-1&token=<hidden>, error: rpc error: unexpected EOF
    2015/09/17 22:24:26 [ERR] http: Request /v1/internal/ui/nodes?dc=eu-west-1&token=<hidden>, error: rpc error: unexpected EOF
    2015/09/17 22:24:26 [ERR] http: Request /v1/internal/ui/nodes?dc=eu-west-1&token=<hidden>, error: rpc error: unexpected EOF
```

It loads fine for us-west-2, which is where 10.179.3.8500 exists in.

I ran `consul members -wan` and see this:

```
Node                        Address             Status  Type    Build  Protocol  DC
ip-10-179-3-152.us-west-2   10.179.3.152:8302   alive   server  0.5.2  2         us-west-2
ip-10-171-154-21.us-east-1  10.171.154.21:8302  alive   server  0.5.2  2         us-east-1
ip-10-172-4-9.eu-west-1     10.172.4.9:8302     alive   server  0.5.2  2         eu-west-1
```

Looks good.

Then I checked the logs for 10.179.3.152 and see this:

```
.
.
.
    2015/09/17 22:20:32 [ERR] memberlist: Push/Pull with ip-10-171-154-21.us-east-1 failed: read tcp 10.171.154.21:8302: i/o timeout
    2015/09/17 22:20:33 [INFO] memberlist: Suspect ip-10-171-154-21.us-east-1 has failed, no acks received
    2015/09/17 22:20:38 [INFO] memberlist: Suspect ip-10-172-4-9.eu-west-1 has failed, no acks received
    2015/09/17 22:20:43 [INFO] memberlist: Marking ip-10-171-154-21.us-east-1 as failed, suspect timeout reached
    2015/09/17 22:20:43 [INFO] serf: EventMemberFailed: ip-10-171-154-21.us-east-1 10.171.154.21
    2015/09/17 22:20:43 [INFO] consul: removing server ip-10-171-154-21.us-east-1 (Addr: 10.171.154.21:8300) (DC: us-east-1)
    2015/09/17 22:20:46 [WARN] memberlist: Refuting a suspect message (from: ip-10-172-4-9.eu-west-1)
    2015/09/17 22:20:48 [INFO] memberlist: Suspect ip-10-172-4-9.eu-west-1 has failed, no acks received
    2015/09/17 22:20:58 [INFO] memberlist: Suspect ip-10-172-4-9.eu-west-1 has failed, no acks received
    2015/09/17 22:21:00 [INFO] serf: EventMemberJoin: ip-10-171-154-21.us-east-1 10.171.154.21
    2015/09/17 22:21:00 [INFO] consul: adding server ip-10-171-154-21.us-east-1 (Addr: 10.171.154.21:8300) (DC: us-east-1)
    2015/09/17 22:21:08 [INFO] memberlist: Suspect ip-10-172-4-9.eu-west-1 has failed, no acks received
    2015/09/17 22:21:13 [INFO] memberlist: Suspect ip-10-171-154-21.us-east-1 has failed, no acks received
    2015/09/17 22:21:18 [INFO] memberlist: Suspect ip-10-172-4-9.eu-west-1 has failed, no acks received
    2015/09/17 22:21:28 [INFO] memberlist: Suspect ip-10-172-4-9.eu-west-1 has failed, no acks received
    2015/09/17 22:21:33 [INFO] memberlist: Suspect ip-10-171-154-21.us-east-1 has failed, no acks received
    2015/09/17 22:21:38 [INFO] memberlist: Marking ip-10-172-4-9.eu-west-1 as failed, suspect timeout reached
    2015/09/17 22:21:38 [INFO] serf: EventMemberFailed: ip-10-172-4-9.eu-west-1 10.172.4.9
    2015/09/17 22:21:38 [INFO] consul: removing server ip-10-172-4-9.eu-west-1 (Addr: 10.172.4.9:8300) (DC: eu-west-1)
    2015/09/17 22:21:38 [INFO] memberlist: Suspect ip-10-172-4-9.eu-west-1 has failed, no acks received
    2015/09/17 22:21:43 [INFO] memberlist: Marking ip-10-171-154-21.us-east-1 as failed, suspect timeout reached
    2015/09/17 22:21:43 [INFO] serf: EventMemberFailed: ip-10-171-154-21.us-east-1 10.171.154.21
    2015/09/17 22:21:43 [INFO] consul: removing server ip-10-171-154-21.us-east-1 (Addr: 10.171.154.21:8300) (DC: us-east-1)
    2015/09/17 22:21:43 [INFO] memberlist: Suspect ip-10-171-154-21.us-east-1 has failed, no acks received
    2015/09/17 22:21:53 [INFO] serf: EventMemberJoin: ip-10-172-4-9.eu-west-1 10.172.4.9
    2015/09/17 22:21:53 [INFO] consul: adding server ip-10-172-4-9.eu-west-1 (Addr: 10.172.4.9:8300) (DC: eu-west-1)
    2015/09/17 22:22:00 [INFO] serf: EventMemberJoin: ip-10-171-154-21.us-east-1 10.171.154.21
    2015/09/17 22:22:00 [INFO] consul: adding server ip-10-171-154-21.us-east-1 (Addr: 10.171.154.21:8300) (DC: us-east-1)
    2015/09/17 22:22:03 [INFO] memberlist: Suspect ip-10-172-4-9.eu-west-1 has failed, no acks received
    2015/09/17 22:22:08 [INFO] memberlist: Suspect ip-10-172-4-9.eu-west-1 has failed, no acks received
    2015/09/17 22:22:13 [INFO] memberlist: Suspect ip-10-171-154-21.us-east-1 has failed, no acks received
    2015/09/17 22:22:18 [INFO] memberlist: Suspect ip-10-172-4-9.eu-west-1 has failed, no acks received
    2015/09/17 22:22:23 [INFO] memberlist: Suspect ip-10-172-4-9.eu-west-1 has failed, no acks received
    2015/09/17 22:22:28 [INFO] memberlist: Suspect ip-10-171-154-21.us-east-1 has failed, no acks received
    2015/09/17 22:22:33 [INFO] memberlist: Marking ip-10-172-4-9.eu-west-1 as failed, suspect timeout reached
    2015/09/17 22:22:33 [INFO] serf: EventMemberFailed: ip-10-172-4-9.eu-west-1 10.172.4.9
    2015/09/17 22:22:33 [INFO] consul: removing server ip-10-172-4-9.eu-west-1 (Addr: 10.172.4.9:8300) (DC: eu-west-1)
    2015/09/17 22:22:33 [INFO] memberlist: Suspect ip-10-172-4-9.eu-west-1 has failed, no acks received
    2015/09/17 22:22:34 [INFO] serf: attempting reconnect to ip-10-172-4-9.eu-west-1 10.172.4.9:8302
    2015/09/17 22:22:35 [INFO] serf: EventMemberJoin: ip-10-172-4-9.eu-west-1 10.172.4.9
    2015/09/17 22:22:35 [INFO] consul: adding server ip-10-172-4-9.eu-west-1 (Addr: 10.172.4.9:8300) (DC: eu-west-1)
    2015/09/17 22:22:38 [INFO] memberlist: Suspect ip-10-171-154-21.us-east-1 has failed, no acks received
    2015/09/17 22:22:43 [INFO] memberlist: Marking ip-10-171-154-21.us-east-1 as failed, suspect timeout reached
    2015/09/17 22:22:43 [INFO] serf: EventMemberFailed: ip-10-171-154-21.us-east-1 10.171.154.21
    2015/09/17 22:22:43 [INFO] consul: removing server ip-10-171-154-21.us-east-1 (Addr: 10.171.154.21:8300) (DC: us-east-1)
    2015/09/17 22:22:43 [INFO] memberlist: Suspect ip-10-172-4-9.eu-west-1 has failed, no acks received
    2015/09/17 22:22:53 [INFO] memberlist: Suspect ip-10-172-4-9.eu-west-1 has failed, no acks received
    2015/09/17 22:22:58 [INFO] memberlist: Suspect ip-10-172-4-9.eu-west-1 has failed, no acks received
    2015/09/17 22:23:08 [INFO] memberlist: Suspect ip-10-172-4-9.eu-west-1 has failed, no acks received
    2015/09/17 22:23:12 [WARN] memberlist: Refuting a dead message (from: ip-10-172-4-9.eu-west-1)
    2015/09/17 22:23:13 [INFO] memberlist: Marking ip-10-172-4-9.eu-west-1 as failed, suspect timeout reached
    2015/09/17 22:23:13 [INFO] serf: EventMemberFailed: ip-10-172-4-9.eu-west-1 10.172.4.9
    2015/09/17 22:23:13 [INFO] consul: removing server ip-10-172-4-9.eu-west-1 (Addr: 10.172.4.9:8300) (DC: eu-west-1)
    2015/09/17 22:23:18 [INFO] memberlist: Suspect ip-10-172-4-9.eu-west-1 has failed, no acks received
    2015/09/17 22:23:25 [INFO] agent.rpc: Accepted client: 127.0.0.1:41986
    2015/09/17 22:23:31 [INFO] agent.rpc: Accepted client: 127.0.0.1:41987
    2015/09/17 22:23:31 [INFO] agent.rpc: Accepted client: 127.0.0.1:41988
    2015/09/17 22:23:32 [INFO] agent.rpc: Accepted client: 127.0.0.1:41989
    2015/09/17 22:23:32 [INFO] serf: EventMemberJoin: ip-10-171-154-21.us-east-1 10.171.154.21
    2015/09/17 22:23:32 [INFO] consul: adding server ip-10-171-154-21.us-east-1 (Addr: 10.171.154.21:8300) (DC: us-east-1)
    2015/09/17 22:23:33 [INFO] agent.rpc: Accepted client: 127.0.0.1:41990
    2015/09/17 22:23:33 [INFO] agent.rpc: Accepted client: 127.0.0.1:41991
    2015/09/17 22:23:34 [INFO] agent.rpc: Accepted client: 127.0.0.1:41992
    2015/09/17 22:23:35 [INFO] agent.rpc: Accepted client: 127.0.0.1:41993
    2015/09/17 22:23:36 [INFO] agent.rpc: Accepted client: 127.0.0.1:41994
    2015/09/17 22:23:38 [INFO] memberlist: Suspect ip-10-171-154-21.us-east-1 has failed, no acks received
    2015/09/17 22:23:47 [INFO] agent.rpc: Accepted client: 127.0.0.1:41996
    2015/09/17 22:23:48 [INFO] memberlist: Suspect ip-10-171-154-21.us-east-1 has failed, no acks received
    2015/09/17 22:23:53 [INFO] serf: EventMemberJoin: ip-10-172-4-9.eu-west-1 10.172.4.9
    2015/09/17 22:23:53 [INFO] consul: adding server ip-10-172-4-9.eu-west-1 (Addr: 10.172.4.9:8300) (DC: eu-west-1)
    2015/09/17 22:23:53 [INFO] memberlist: Suspect ip-10-171-154-21.us-east-1 has failed, no acks received
    2015/09/17 22:23:58 [INFO] memberlist: Suspect ip-10-171-154-21.us-east-1 has failed, no acks received
    2015/09/17 22:24:03 [INFO] memberlist: Suspect ip-10-172-4-9.eu-west-1 has failed, no acks received
    2015/09/17 22:24:08 [INFO] memberlist: Suspect ip-10-171-154-21.us-east-1 has failed, no acks received
    2015/09/17 22:24:13 [INFO] memberlist: Suspect ip-10-172-4-9.eu-west-1 has failed, no acks received
    2015/09/17 22:24:18 [INFO] memberlist: Suspect ip-10-171-154-21.us-east-1 has failed, no acks received
    2015/09/17 22:24:23 [INFO] memberlist: Suspect ip-10-171-154-21.us-east-1 has failed, no acks received
    2015/09/17 22:24:26 [ERR] yamux: Failed to read header: read tcp 10.172.4.9:8300: connection timed out
    2015/09/17 22:24:26 [ERR] http: Request /v1/internal/ui/nodes?dc=eu-west-1&token=<hidden>, error: rpc error: unexpected EOF
    2015/09/17 22:24:26 [ERR] http: Request /v1/internal/ui/nodes?dc=eu-west-1&token=<hidden>, error: rpc error: unexpected EOF
    2015/09/17 22:24:26 [ERR] http: Request /v1/internal/ui/nodes?dc=eu-west-1&token=<hidden>, error: rpc error: unexpected EOF
    2015/09/17 22:24:28 [INFO] memberlist: Marking ip-10-171-154-21.us-east-1 as failed, suspect timeout reached
    2015/09/17 22:24:28 [INFO] serf: EventMemberFailed: ip-10-171-154-21.us-east-1 10.171.154.21
    2015/09/17 22:24:28 [INFO] consul: removing server ip-10-171-154-21.us-east-1 (Addr: 10.171.154.21:8300) (DC: us-east-1)
    2015/09/17 22:24:28 [INFO] memberlist: Suspect ip-10-172-4-9.eu-west-1 has failed, no acks received
    2015/09/17 22:24:30 [INFO] serf: EventMemberJoin: ip-10-171-154-21.us-east-1 10.171.154.21
    2015/09/17 22:24:30 [INFO] consul: adding server ip-10-171-154-21.us-east-1 (Addr: 10.171.154.21:8300) (DC: us-east-1)
    2015/09/17 22:24:38 [INFO] memberlist: Suspect ip-10-172-4-9.eu-west-1 has failed, no acks received
    2015/09/17 22:24:43 [INFO] memberlist: Suspect ip-10-172-4-9.eu-west-1 has failed, no acks received
    2015/09/17 22:24:48 [INFO] memberlist: Suspect ip-10-171-154-21.us-east-1 has failed, no acks received
    2015/09/17 22:24:58 [INFO] memberlist: Suspect ip-10-171-154-21.us-east-1 has failed, no acks received
    2015/09/17 22:25:02 [ERR] memberlist: Push/Pull with ip-10-171-154-21.us-east-1 failed: read tcp 10.171.154.21:8302: i/o timeout
    2015/09/17 22:25:03 [INFO] memberlist: Suspect ip-10-172-4-9.eu-west-1 has failed, no acks received
    2015/09/17 22:25:08 [INFO] memberlist: Suspect ip-10-171-154-21.us-east-1 has failed, no acks received
    2015/09/17 22:25:13 [INFO] memberlist: Suspect ip-10-172-4-9.eu-west-1 has failed, no acks received
    2015/09/17 22:25:18 [INFO] memberlist: Suspect ip-10-172-4-9.eu-west-1 has failed, no acks received
    2015/09/17 22:25:18 [INFO] memberlist: Marking ip-10-171-154-21.us-east-1 as failed, suspect timeout reached
    2015/09/17 22:25:18 [INFO] serf: EventMemberFailed: ip-10-171-154-21.us-east-1 10.171.154.21
    2015/09/17 22:25:18 [INFO] consul: removing server ip-10-171-154-21.us-east-1 (Addr: 10.171.154.21:8300) (DC: us-east-1)
    2015/09/17 22:25:19 [INFO] memberlist: Marking ip-10-172-4-9.eu-west-1 as failed, suspect timeout reached
    2015/09/17 22:25:19 [INFO] serf: EventMemberFailed: ip-10-172-4-9.eu-west-1 10.172.4.9
    2015/09/17 22:25:19 [INFO] consul: removing server ip-10-172-4-9.eu-west-1 (Addr: 10.172.4.9:8300) (DC: eu-west-1)
    2015/09/17 22:25:23 [INFO] memberlist: Suspect ip-10-171-154-21.us-east-1 has failed, no acks received
    2015/09/17 22:25:30 [INFO] serf: EventMemberJoin: ip-10-171-154-21.us-east-1 10.171.154.21
    2015/09/17 22:25:30 [INFO] consul: adding server ip-10-171-154-21.us-east-1 (Addr: 10.171.154.21:8300) (DC: us-east-1)
    2015/09/17 22:25:34 [INFO] serf: attempting reconnect to ip-10-172-4-9.eu-west-1 10.172.4.9:8302
    2015/09/17 22:25:35 [INFO] serf: EventMemberJoin: ip-10-172-4-9.eu-west-1 10.172.4.9
    2015/09/17 22:25:35 [INFO] consul: adding server ip-10-172-4-9.eu-west-1 (Addr: 10.172.4.9:8300) (DC: eu-west-1)
    2015/09/17 22:25:43 [INFO] memberlist: Suspect ip-10-172-4-9.eu-west-1 has failed, no acks received
    2015/09/17 22:25:48 [INFO] memberlist: Suspect ip-10-171-154-21.us-east-1 has failed, no acks received
    2015/09/17 22:25:54 [WARN] memberlist: Refuting a suspect message (from: ip-10-172-4-9.eu-west-1)
    2015/09/17 22:25:58 [INFO] memberlist: Suspect ip-10-172-4-9.eu-west-1 has failed, no acks received
    2015/09/17 22:26:03 [INFO] agent.rpc: Accepted client: 127.0.0.1:42004
    2015/09/17 22:26:03 [INFO] memberlist: Suspect ip-10-171-154-21.us-east-1 has failed, no acks received
    2015/09/17 22:26:08 [INFO] memberlist: Suspect ip-10-171-154-21.us-east-1 has failed, no acks received
    2015/09/17 22:26:13 [INFO] memberlist: Marking ip-10-172-4-9.eu-west-1 as failed, suspect timeout reached
    2015/09/17 22:26:13 [INFO] serf: EventMemberFailed: ip-10-172-4-9.eu-west-1 10.172.4.9
    2015/09/17 22:26:13 [INFO] consul: removing server ip-10-172-4-9.eu-west-1 (Addr: 10.172.4.9:8300) (DC: eu-west-1)
    2015/09/17 22:26:13 [INFO] memberlist: Suspect ip-10-172-4-9.eu-west-1 has failed, no acks received
    2015/09/17 22:26:16 [WARN] memberlist: Refuting a suspect message (from: ip-10-171-154-21.us-east-1)
    2015/09/17 22:26:18 [INFO] memberlist: Suspect ip-10-171-154-21.us-east-1 has failed, no acks received
.
.
.
```

So I'm thinking ok, I must have one of the ports block. So I ran netcat to check the SERF ports and those succeed:

```
ubuntu@ip-10-179-3-152:~$ netcat -zvu 10.172.4.9 8301
Connection to 10.172.4.9 8301 port [udp/*] succeeded!
ubuntu@ip-10-179-3-152:~$ netcat -zvu 10.172.4.9 8302
Connection to 10.172.4.9 8302 port [udp/*] succeeded!
ubuntu@ip-10-179-3-152:~$ netcat -zv 10.172.4.9 8302
Connection to 10.172.4.9 8302 port [tcp/*] succeeded!
ubuntu@ip-10-179-3-152:~$ netcat -zv 10.172.4.9 8301
Connection to 10.172.4.9 8301 port [tcp/*] succeeded!
```

Ran the same against the us-east-1 box, and those succeed as well.

Now I'm not sure what to do because the ports are open, and the communication appears open, but Consul doesn't want to communicate. Am I missing a port?

Also, if I navigate to the UI on any other consul server in the cluster, it doesn't see the new datacenters? I thought the WAN joins were supposed to replicate to the other servers as well?

**Comment by highlyunavailable** [comment]
You also need to allow inbound TCP 8300 (Consul Server RPC) to all Servers. Server RPC is what is actually used by agents (and other servers) do to queries to remote Consul servers.

**Comment by djenriquez** [comment]
Yup, @highlyunavailable  traffic is open both ways for ports 8300, 8301/udp, 8301, 8302/udp, 8302, 8400, and 8500.

```
ubuntu@ip-10-179-3-152:~$ netcat -zv 10.172.4.9 8300
Connection to 10.172.4.9 8300 port [tcp/*] succeeded!
```

I will note that the response from netcat for the udp ports 8301 and 8302 has delay, almost 3 seconds. Is this latency causing the problem?

**Comment by slackpad** [comment]
Hi @djenriquez - it does look like you have the right set of ports. Do things work for a while and then fail sporadically, or do they always fail?

**Comment by djenriquez** [comment]
They're always in a failed state. It looks like its going to work in the beginning because you can see the multi-datacenter screen in the beginning asking you to select a datacenter. If you select the datacenter that the server you're accessing through exists in, it loads fine. If you click on any other datacenter, the screen changes to the empty rectangle box with an image icon at the top left, and "Loading..." right below.

After about a minute it changes to a 504 timeout.

```
HTTP error code from Consul: 504 GATEWAY_TIMEOUT

This is an error page for the Consul web UI. You may have visited a URL that is loading an unknown resource, so you can try going back to the root.

Otherwise, please report any unexpected issues on the GitHub page.
```

**Comment by slackpad** [comment]
The other thing I was thinking to check is that Consul bound to the correct network interface. It should show that when it starts up or you could do a `netstat -a` and look for the Consul ports in there.

**Comment by djenriquez** [comment]
Looks right, I think. :stuck_out_tongue_closed_eyes: 

us-west-2
```
ubuntu@ip-10-179-3-152:~$ netstat -a
Active Internet connections (servers and established)
Proto Recv-Q Send-Q Local Address           Foreign Address         State      
tcp        0      0 *:ssh                   *:*                     LISTEN     
tcp        0      0 10.179.3.152:8300       *:*                     LISTEN     
tcp        0      0 10.179.3.152:8301       *:*                     LISTEN     
tcp        0      0 10.179.3.152:8302       *:*                     LISTEN     
tcp        0      0 10.179.3.152:8400       *:*                     LISTEN     
tcp        0      0 10.179.3.152:8500       *:*                     LISTEN     
tcp        0      0 172.17.42.1:domain      *:*                     LISTEN     
tcp        0    324 10.179.3.152:ssh        10.120.94.19:59449      ESTABLISHED
tcp6       0      0 [::]:ssh                [::]:*                  LISTEN     
udp        0      0 *:37351                 *:*                                
udp        0      0 172.17.42.1:domain      *:*                                
udp        0      0 *:bootpc                *:*                                
udp        0      0 10.179.3.152:8301       *:*                                
udp        0      0 10.179.3.152:8302       *:*                                
udp6       0      0 [::]:7365               [::]:*                             
Active UNIX domain sockets (servers and established)
Proto RefCnt Flags       Type       State         I-Node   Path
unix  2      [ ACC ]     SEQPACKET  LISTENING     7430     /run/udev/control
unix  2      [ ACC ]     STREAM     LISTENING     8731     /var/run/dbus/system_bus_socket
unix  2      [ ACC ]     STREAM     LISTENING     41000    /var/run/docker.sock
unix  2      [ ACC ]     STREAM     LISTENING     6665     @/com/ubuntu/upstart
unix  2      [ ACC ]     STREAM     LISTENING     9061     /var/run/acpid.socket
unix  5      [ ]         DGRAM                    8867     /dev/log
unix  2      [ ]         DGRAM                    9058     
unix  3      [ ]         STREAM     CONNECTED     107850   
unix  2      [ ]         STREAM     CONNECTED     46912    /var/run/docker.sock
unix  3      [ ]         STREAM     CONNECTED     107845   
unix  3      [ ]         STREAM     CONNECTED     8765     /var/run/dbus/system_bus_socket
unix  3      [ ]         STREAM     CONNECTED     7412     
unix  3      [ ]         STREAM     CONNECTED     8757     
unix  3      [ ]         STREAM     CONNECTED     7938     @/com/ubuntu/upstart
unix  3      [ ]         STREAM     CONNECTED     7425     @/com/ubuntu/upstart
unix  3      [ ]         STREAM     CONNECTED     8840     /var/run/dbus/system_bus_socket
unix  3      [ ]         STREAM     CONNECTED     8839     
unix  2      [ ]         DGRAM                    44421    
unix  3      [ ]         STREAM     CONNECTED     8764     
unix  3      [ ]         DGRAM                    7464     
unix  3      [ ]         STREAM     CONNECTED     107844   
unix  3      [ ]         STREAM     CONNECTED     7936     
unix  2      [ ]         DGRAM                    107664   
unix  3      [ ]         STREAM     CONNECTED     107851   /var/run/dbus/system_bus_socket
unix  3      [ ]         DGRAM                    7463     
unix  3      [ ]         STREAM     CONNECTED     8756     
unix  3      [ ]         STREAM     CONNECTED     41015    /var/run/dbus/system_bus_socket
unix  3      [ ]         STREAM     CONNECTED     8713     
unix  3      [ ]         STREAM     CONNECTED     8749     @/com/ubuntu/upstart
unix  3      [ ]         STREAM     CONNECTED     41014
```

us-east-1
```
Active Internet connections (servers and established)
Proto Recv-Q Send-Q Local Address           Foreign Address         State      
tcp        0      0 *:ssh                   *:*                     LISTEN     
tcp        0      0 10.172.4.9:8300         *:*                     LISTEN     
tcp        0      0 10.172.4.9:8301         *:*                     LISTEN     
tcp        0      0 10.172.4.9:8302         *:*                     LISTEN     
tcp        0      0 10.172.4.9:8400         *:*                     LISTEN     
tcp        0      0 10.172.4.9:8500         *:*                     LISTEN     
tcp        0      0 172.17.42.1:domain      *:*                     LISTEN     
tcp        0     36 10.172.4.9:ssh          10.120.94.19:59458      ESTABLISHED
tcp6       0      0 [::]:ssh                [::]:*                  LISTEN     
udp        0      0 *:27501                 *:*                                
udp        0      0 172.17.42.1:domain      *:*                                
udp        0      0 *:bootpc                *:*                                
udp        0      0 10.172.4.9:8301         *:*                                
udp        0      0 10.172.4.9:8302         *:*                                
udp6       0      0 [::]:49544              [::]:*                             
Active UNIX domain sockets (servers and established)
Proto RefCnt Flags       Type       State         I-Node   Path
unix  2      [ ACC ]     SEQPACKET  LISTENING     7430     /run/udev/control
unix  2      [ ACC ]     STREAM     LISTENING     8743     /var/run/dbus/system_bus_socket
unix  2      [ ACC ]     STREAM     LISTENING     6667     @/com/ubuntu/upstart
unix  2      [ ACC ]     STREAM     LISTENING     9065     /var/run/acpid.socket
unix  5      [ ]         DGRAM                    8915     /dev/log
unix  2      [ ACC ]     STREAM     LISTENING     40682    /var/run/docker.sock
unix  3      [ ]         STREAM     CONNECTED     116648   /var/run/dbus/system_bus_socket
unix  3      [ ]         STREAM     CONNECTED     8784     
unix  3      [ ]         STREAM     CONNECTED     8782     
unix  3      [ ]         STREAM     CONNECTED     116647   
unix  3      [ ]         STREAM     CONNECTED     7414     
unix  3      [ ]         STREAM     CONNECTED     7922     @/com/ubuntu/upstart
unix  3      [ ]         STREAM     CONNECTED     8713     
unix  3      [ ]         STREAM     CONNECTED     40697    /var/run/dbus/system_bus_socket
unix  3      [ ]         STREAM     CONNECTED     116639   
unix  2      [ ]         DGRAM                    44237    
unix  3      [ ]         STREAM     CONNECTED     8845     /var/run/dbus/system_bus_socket
unix  3      [ ]         STREAM     CONNECTED     116638   
unix  2      [ ]         DGRAM                    9062     
unix  3      [ ]         DGRAM                    7464     
unix  3      [ ]         STREAM     CONNECTED     8785     /var/run/dbus/system_bus_socket
unix  3      [ ]         STREAM     CONNECTED     7425     @/com/ubuntu/upstart
unix  3      [ ]         DGRAM                    7463     
unix  3      [ ]         STREAM     CONNECTED     7915     
unix  2      [ ]         DGRAM                    116447   
unix  3      [ ]         STREAM     CONNECTED     8844     
unix  3      [ ]         STREAM     CONNECTED     40696    
unix  3      [ ]         STREAM     CONNECTED     8749     @/com/ubuntu/upstart
unix  3      [ ]         STREAM     CONNECTED     8781
```

I appreciate your time on this @slackpad.

**Comment by slackpad** [comment]
In a previous comment you mentioned that there were 3 second delays in this communication path - is that still the case? The probe timeout for WAN is right at 3 seconds so maybe that's the root of the other communication issue (the DC is coming and going).

**Comment by djenriquez** [comment]
The 3 second delay was related to netcat's defaults. When listening on the recipient server, it seems netcat waits for 5 udp packets to be sent before saying "Connected". I'm not sure how this works by nature of UDP, but it succeeds. If we limit the netcat test to 1 second timeouts, the listening server only received one packet, but still succeeds.

I'm thinking the 3 second delay is just related to netcat's default of 5 UDP packets before saying "Connected".

**Comment by slackpad** [comment]
Ok I see. Can you take a little data with `tcpdump` while Consul is running
so we can try to trace what's going on?

**Comment by djenriquez** [comment]
From the us-west-2 server
```
$ sudo tcpdump -vvi eth0 src 10.172.4.9
tcpdump: listening on eth0, link-type EN10MB (Ethernet), capture size 65535 bytes
20:03:01.925674 IP (tos 0x0, ttl 59, id 0, offset 0, flags [DF], proto TCP (6), length 60)
    10.172.4.9.8302 > 10.179.3.152.46083: Flags [S.], cksum 0x0123 (correct), seq 2946270357, ack 2513996524, win 26847, options [mss 8961,sackOK,TS val 108622633 ecr 87489375,nop,wscale 7], length 0
20:05:02.068040 IP (tos 0x0, ttl 59, id 0, offset 0, flags [DF], proto TCP (6), length 60)
    10.172.4.9.8302 > 10.179.3.152.46089: Flags [S.], cksum 0xf0be (correct), seq 3102724895, ack 1075424900, win 26847, options [mss 8961,sackOK,TS val 108652669 ecr 87519410,nop,wscale 7], length 0
20:06:02.208931 IP (tos 0x0, ttl 59, id 0, offset 0, flags [DF], proto TCP (6), length 60)
    10.172.4.9.8302 > 10.179.3.152.46092: Flags [S.], cksum 0xdf35 (correct), seq 256252973, ack 1996780611, win 26847, options [mss 8961,sackOK,TS val 108667705 ecr 87534446,nop,wscale 7], length 0

```
```
$ sudo tcpdump -vvi eth0 dst 10.172.4.9
tcpdump: listening on eth0, link-type EN10MB (Ethernet), capture size 65535 bytes
20:08:02.210401 IP (tos 0x0, ttl 63, id 59521, offset 0, flags [DF], proto TCP (6), length 60)
    10.179.3.152.46098 > 10.172.4.9.8302: Flags [S], cksum 0x1d2e (incorrect -> 0x73ed), seq 1846069312, win 26883, options [mss 8961,sackOK,TS val 87564481 ecr 0,nop,wscale 7], length 0
20:08:02.350617 IP (tos 0x0, ttl 63, id 59522, offset 0, flags [DF], proto TCP (6), length 52)
    10.179.3.152.46098 > 10.172.4.9.8302: Flags [.], cksum 0x1d26 (incorrect -> 0x00c2), seq 1846069313, ack 3995507219, win 211, options [nop,nop,TS val 87564516 ecr 108697741], length 0
20:08:02.351037 IP (tos 0x0, ttl 63, id 59523, offset 0, flags [DF], proto TCP (6), length 437)
    10.179.3.152.46098 > 10.172.4.9.8302: Flags [P.], cksum 0x1ea7 (incorrect -> 0xd6d7), seq 0:385, ack 1, win 211, options [nop,nop,TS val 87564516 ecr 108697741], length 385
20:08:02.756405 IP (tos 0x0, ttl 63, id 59524, offset 0, flags [DF], proto TCP (6), length 437)
    10.179.3.152.46098 > 10.172.4.9.8302: Flags [P.], cksum 0x1ea7 (incorrect -> 0xd671), seq 0:385, ack 1, win 211, options [nop,nop,TS val 87564618 ecr 108697741], length 385
20:08:03.176406 IP (tos 0x0, ttl 63, id 59525, offset 0, flags [DF], proto TCP (6), length 437)
    10.179.3.152.46098 > 10.172.4.9.8302: Flags [P.], cksum 0x1ea7 (incorrect -> 0xd608), seq 0:385, ack 1, win 211, options [nop,nop,TS val 87564723 ecr 108697741], length 385
20:08:04.016410 IP (tos 0x0, ttl 63, id 59526, offset 0, flags [DF], proto TCP (6), length 437)
    10.179.3.152.46098 > 10.172.4.9.8302: Flags [P.], cksum 0x1ea7 (incorrect -> 0xd536), seq 0:385, ack 1, win 211, options [nop,nop,TS val 87564933 ecr 108697741], length 385
20:08:05.700414 IP (tos 0x0, ttl 63, id 59527, offset 0, flags [DF], proto TCP (6), length 437)
    10.179.3.152.46098 > 10.172.4.9.8302: Flags [P.], cksum 0x1ea7 (incorrect -> 0xd391), seq 0:385, ack 1, win 211, options [nop,nop,TS val 87565354 ecr 108697741], length 385
20:08:09.068419 IP (tos 0x0, ttl 63, id 59528, offset 0, flags [DF], proto TCP (6), length 437)
    10.179.3.152.46098 > 10.172.4.9.8302: Flags [P.], cksum 0x1ea7 (incorrect -> 0xd047), seq 0:385, ack 1, win 211, options [nop,nop,TS val 87566196 ecr 108697741], length 385
20:08:15.804426 IP (tos 0x0, ttl 63, id 59529, offset 0, flags [DF], proto TCP (6), length 437)
    10.179.3.152.46098 > 10.172.4.9.8302: Flags [P.], cksum 0x1ea7 (incorrect -> 0xc9b3), seq 0:385, ack 1, win 211, options [nop,nop,TS val 87567880 ecr 108697741], length 385
20:08:29.276407 IP (tos 0x0, ttl 63, id 59530, offset 0, flags [DF], proto TCP (6), length 437)
    10.179.3.152.46098 > 10.172.4.9.8302: Flags [P.], cksum 0x1ea7 (incorrect -> 0xbc8b), seq 0:385, ack 1, win 211, options [nop,nop,TS val 87571248 ecr 108697741], length 385
20:08:32.351250 IP (tos 0x0, ttl 63, id 59531, offset 0, flags [DF], proto TCP (6), length 52)
    10.179.3.152.46098 > 10.172.4.9.8302: Flags [F.], cksum 0x1d26 (incorrect -> 0xe1f3), seq 385, ack 1, win 211, options [nop,nop,TS val 87572016 ecr 108697741], length 0
```

From the us-east-1 server
```
sudo tcpdump -vvi eth0 dst 10.179.3.152
tcpdump: listening on eth0, link-type EN10MB (Ethernet), capture size 65535 bytes
20:06:39.794686 IP (tos 0x0, ttl 63, id 54068, offset 0, flags [DF], proto UDP (17), length 153)
    10.172.4.9.8302 > 10.179.3.152.8302: [bad udp cksum 0x1d96 -> 0x9a41!] UDP, length 125
20:06:49.795244 IP (tos 0x0, ttl 63, id 54303, offset 0, flags [DF], proto UDP (17), length 153)
    10.172.4.9.8302 > 10.179.3.152.8302: [bad udp cksum 0x1d96 -> 0x9a3f!] UDP, length 125
20:06:59.794951 IP (tos 0x0, ttl 63, id 56612, offset 0, flags [DF], proto UDP (17), length 203)
    10.172.4.9.8302 > 10.179.3.152.8302: [bad udp cksum 0x1dc8 -> 0xcb65!] UDP, length 175
20:07:04.795312 IP (tos 0x0, ttl 63, id 57347, offset 0, flags [DF], proto UDP (17), length 154)
    10.172.4.9.8302 > 10.179.3.152.8302: [bad udp cksum 0x1d97 -> 0xa538!] UDP, length 126
20:07:17.970377 IP (tos 0x0, ttl 63, id 58272, offset 0, flags [DF], proto TCP (6), length 60)
    10.172.4.9.52103 > 10.179.3.152.8302: Flags [S], cksum 0x1d2e (incorrect -> 0x7064), seq 640531879, win 26883, options [mss 8961,sackOK,TS val 108682759 ecr 0,nop,wscale 7], length 0
20:07:18.110020 IP (tos 0x0, ttl 63, id 58273, offset 0, flags [DF], proto TCP (6), length 52)
    10.172.4.9.52103 > 10.179.3.152.8302: Flags [.], cksum 0x1d26 (incorrect -> 0x80cd), seq 640531880, ack 4283939007, win 211, options [nop,nop,TS val 108682794 ecr 87549534], length 0
20:07:18.110440 IP (tos 0x0, ttl 63, id 58274, offset 0, flags [DF], proto TCP (6), length 436)
    10.172.4.9.52103 > 10.179.3.152.8302: Flags [P.], cksum 0x1ea6 (incorrect -> 0x5cd9), seq 0:384, ack 1, win 211, options [nop,nop,TS val 108682794 ecr 87549534], length 384
20:07:18.515460 IP (tos 0x0, ttl 63, id 58275, offset 0, flags [DF], proto TCP (6), length 436)
    10.172.4.9.52103 > 10.179.3.152.8302: Flags [P.], cksum 0x1ea6 (incorrect -> 0x5c73), seq 0:384, ack 1, win 211, options [nop,nop,TS val 108682896 ecr 87549534], length 384
20:07:18.935455 IP (tos 0x0, ttl 63, id 58276, offset 0, flags [DF], proto TCP (6), length 436)
    10.172.4.9.52103 > 10.179.3.152.8302: Flags [P.], cksum 0x1ea6 (incorrect -> 0x5c0a), seq 0:384, ack 1, win 211, options [nop,nop,TS val 108683001 ecr 87549534], length 384
20:07:19.294755 IP (tos 0x0, ttl 63, id 60862, offset 0, flags [DF], proto UDP (17), length 290)
    10.172.4.9.8302 > 10.179.3.152.8302: [bad udp cksum 0x1e1f -> 0x7aa9!] UDP, length 262
20:07:19.775442 IP (tos 0x0, ttl 63, id 58277, offset 0, flags [DF], proto TCP (6), length 436)
    10.172.4.9.52103 > 10.179.3.152.8302: Flags [P.], cksum 0x1ea6 (incorrect -> 0x5b38), seq 0:384, ack 1, win 211, options [nop,nop,TS val 108683211 ecr 87549534], length 384
20:07:19.794701 IP (tos 0x0, ttl 63, id 60878, offset 0, flags [DF], proto UDP (17), length 210)
    10.172.4.9.8302 > 10.179.3.152.8302: [bad udp cksum 0x1dcf -> 0x9f71!] UDP, length 182
```

`$ sudo tcpdump -vvi eth0 src 10.179.3.152` didn't return anything

The `consul join -wan <server1>` was executed on the us-east-1 server targetting the us-west-2 server, if that makes a difference....

Honestly I don't know much about this layer of networking, but i see some weird...ports? Like
```
20:07:19.775442 IP (tos 0x0, ttl 63, id 58277, offset 0, flags [DF], proto TCP (6), length 436)
    10.172.4.9.52103 > 10.179.3.152.8302: Flags [P.], cksum 0x1ea6 (incorrect -> 0x5b38), seq 0:384, ack 1, win 211, options [nop,nop,TS val 108683211 ecr 87549534], length 384
```
Is docker doing something funny with these UDP packets?

**Comment by djenriquez** [comment]
Ran it again on the us-west-2 server and got a bunch of UDP related stuff this time:

```
tcpdump: listening on eth0, link-type EN10MB (Ethernet), capture size 65535 bytes
20:13:23.936058 IP (tos 0x0, ttl 63, id 16975, offset 0, flags [DF], proto UDP (17), length 252)
    10.179.3.152.8302 > 10.172.4.9.8302: [bad udp cksum 0x1df9 -> 0xcf5c!] UDP, length 224
20:13:24.435212 IP (tos 0x0, ttl 63, id 17059, offset 0, flags [DF], proto UDP (17), length 339)
    10.179.3.152.8302 > 10.172.4.9.8302: [bad udp cksum 0x1e50 -> 0xbbfb!] UDP, length 311
20:13:24.935232 IP (tos 0x0, ttl 63, id 17159, offset 0, flags [DF], proto UDP (17), length 339)
    10.179.3.152.8302 > 10.172.4.9.8302: [bad udp cksum 0x1e50 -> 0xbbfb!] UDP, length 311
20:13:25.435254 IP (tos 0x0, ttl 63, id 17186, offset 0, flags [DF], proto UDP (17), length 339)
    10.179.3.152.8302 > 10.172.4.9.8302: [bad udp cksum 0x1e50 -> 0xbbfb!] UDP, length 311
20:13:25.935224 IP (tos 0x0, ttl 63, id 17215, offset 0, flags [DF], proto UDP (17), length 208)
    10.179.3.152.8302 > 10.172.4.9.8302: [bad udp cksum 0x1dcd -> 0xad49!] UDP, length 180
20:13:31.228468 IP (tos 0x0, ttl 63, id 37268, offset 0, flags [DF], proto TCP (6), length 542)
    10.179.3.152.46112 > 10.172.4.9.8302: Flags [FP.], cksum 0x1f10 (incorrect -> 0xe794), seq 3457923398:3457923888, ack 1492131820, win 211, options [nop,nop,TS val 87646736 ecr 108765338], length 490
20:13:31.936767 IP (tos 0x0, ttl 63, id 18191, offset 0, flags [DF], proto UDP (17), length 91)
    10.179.3.152.8302 > 10.172.4.9.8302: [bad udp cksum 0x1d58 -> 0xf38c!] UDP, length 63
20:13:33.936795 IP (tos 0x0, ttl 63, id 18252, offset 0, flags [DF], proto UDP (17), length 154)
    10.179.3.152.8302 > 10.172.4.9.8302: [bad udp cksum 0x1d97 -> 0x76d1!] UDP, length 126
20:13:34.435248 IP (tos 0x0, ttl 63, id 18273, offset 0, flags [DF], proto UDP (17), length 112)
    10.179.3.152.8302 > 10.172.4.9.8302: [bad udp cksum 0x1d6d -> 0x34e8!] UDP, length 84
20:13:34.935194 IP (tos 0x0, ttl 63, id 18274, offset 0, flags [DF], proto UDP (17), length 112)
    10.179.3.152.8302 > 10.172.4.9.8302: [bad udp cksum 0x1d6d -> 0x34e8!] UDP, length 84
```

**Comment by slackpad** [comment]
The weird ports are the ephemeral TCP ports, so that's ok. The direction you `join` in shouldn't make a difference, though you do have to join each of the WAN nodes to get them all. It's interesting there are no TCP streams to port 8300 in your packet captures. Were you trying to load the DC page during any of these?

**Comment by djenriquez** [comment]
Ah, I don't remember @slackpad, sorry.

I noticed that the consul DCs attempt to join each other, then give up for a period of time and then retry again later. I came to this conclusion because when I navigate to 10.179.3.152:8500, there are periods of time where US-EAST-1 does not appear in the datacenter list, then it'll eventually come back.

In no case does clicking on that datacenter load successfully.

Are there any scenarios you would like me to capture? I would post all of the tcpdump in here, but theres just a ton of records.

**Comment by slackpad** [comment]
It would be good to get a cap (with data as a .pcap) of you trying to join a WAN node and doing a query to that DC. You can email it to james at hashicorp.com and I'll take a look, though it'll probably take me a few days to get to it right now.

**Comment by djenriquez** [comment]
Will do, no problem. Its not preventing us from doing anything, just losing the convenience of switching datacenters from one page.

I'll get those to you soon.

**Comment by djenriquez** [comment]
@slackpad Is there a way to "cancel" the join command? Since this isn't working for us at the moment, i'd like Consul to just stop trying to join. Its been trying to join for a little under two weeks now!

**Comment by slackpad** [comment]
@djenriquez that doesn't sound right! The `join` should be a one-shot thing. Did you run it with `consul join -wan`.

**Comment by djenriquez** [comment]
Yes, well the strange thing is remember, it IS joined, its just having issues with communication between datacenters, but I do see the other datacenters when i run `consul members -wan`:

```
bash-4.3# consul members -wan
Node                         Address              Status  Type    Build  Protocol  DC
ip-10-179-3-152.us-west-2    10.179.3.152:8302    failed  server  0.5.2  2         us-west-2
ip-10-172-4-9.eu-west-1      10.172.4.9:8302      failed  server  0.5.2  2         eu-west-1
```

so maybe a better question is, how do i tell it to leave?

**Comment by slackpad** [comment]
I see. Unfortunately there's not a leave command for the WAN pool so you'd have to restart Consul, or cut off their traffic and let Serf declare them dead.

**Comment by hosunghwang** [comment]
Hi, @slackpad. Could you please elaborate leave process for the WAN pool in details?
I also need to disjoin datacenters.
You mentioned two ways to do it.

1. Issue  'consul leave' or 'consul force-leave' command and restart Consul.

If I do this, I suppose that I need to do it on each node and it is hard to do it by a script in an automated way since I need to restart Consul.

Even if I do this manually, will this leave just WAN protocol but keep LAN protocol as it were before joined to another datacenter?

2. Cut off the traffic and let Sert declare them dead.

Does this mean I need to update some configuration for raft or consul?
For example, take out serf_wan from consul.conf?

```
"ports": {
    "dns": -1,
    "server": 8300,
    "serf_lan": 8301,
    "serf_wan": 8302
  },
```

I would appreciate your answer in advance.

**Comment by maciekciolek** [comment]
@djenriquez did you solve the problem with this UDP packets on eu-west-1? It look like I am facing the same problem with Consul on AWS.

**Comment by slackpad** [comment]
> Cut off the traffic and let Sert declare them dead.

For that approach you could use something like iptables to block 8302/tcp and 8302/udp and wait for things to expire.

We will close this against https://github.com/hashicorp/consul/issues/3000 which captures the forward work of making an easier way to leave the WAN.
